<?xml version="1.0" encoding="UTF-8"?>
<aeropuerto xmlns:xsi="http://www.w3.org/2001/XMLSchema-instance"
xsi:noNamespaceSchemaLocation="Ejercicio10Schema.xsd">

   <fecha>2013-12-20</fecha>  <!-- Cambio el orden de las etiquetas-->

   <nombre>JFK</nombre>
   
   <vuelos>
      <vuelo código="V22" estado="R">   <!-- El atributo codigo es de tipo ID-->
         <diario />
         <origen>New York</origen>
         <destino>Chicago</destino>
         <hora-salida>09:30:00</hora-salida>
         <hora-llegada>11:30:00</hora-llegada>
      </vuelo>
      <vuelo código="V23" estado="C">    <!-- Si no se indica el estado por defecto es E-->
         <origen>New York</origen>
         <destino>Miami</destino>
         <hora-salida>10:15:00</hora-salida>
         <hora-llegada>11:15:00</hora-llegada>
      </vuelo>
   </vuelos>
</aeropuerto>